{
  "schema": "misconception/v1",
  "id": "M-CNT-CARD",
  "review": "needs-editor",
  "skills": [
    "NUM-A-04"
  ],
  "parentText": "הילד סופר שוב במקום לומר כמה יש בסך הכול, או נותן את כל העצמים כשמבקשים מספר מסוים.",
  "homeActivity": [
    {
      "t": "he",
      "v": "בארוחה, לבקש מהילד להגיש שלושה פירות ולספור אותם בקול. אחרי הספירה לשאול: כמה יש בסך הכול? בלי לתקן, רק לספור שוב יחד."
    }
  ],
  "repairActivities": [],
  "preferredRepresentations": [
    "pictorial",
    "embodied"
  ]
}
